{"name":"extract-claims","phase":"understand","version":1,"lead_agent":"source-analyst","consumes":["normalized-evidence"],"produces":["claim-set"],"permissions":{"read":["sources/normalized/**","workflow/runs/**"],"write":["workflow/runs/**/claims/**"]},"sensors":["source-anchor-valid"],"gates":{"before":null,"after":"claims-schema-valid"},"retry":{"safe":true},"deterministic":false}
