{"name":"prepare-publication","phase":"govern","version":1,"lead_agent":"conductor","consumes":["concept-proposals","review-packet","review-receipt"],"produces":["publication-intent"],"depends_on":["review-proposal"],"permissions":{"read":["workflow/runs/**"],"write":["workflow/runs/**/publication/**"]},"sensors":["stable-policy-valid","review-binding-valid"],"gates":{"before":"publication-authorized","after":null},"retry":{"safe":true},"deterministic":true}
