{"name":"review-proposal","phase":"govern","version":1,"lead_agent":"trust-reviewer","consumes":["concept-proposals","claim-set"],"produces":["review-packet","review-receipt"],"depends_on":["plan-concepts"],"permissions":{"read":["workflow/runs/**","sources/normalized/**","knowledge-bases/**"],"write":["workflow/runs/**/receipts/**"]},"sensors":["review-binding-valid"],"gates":{"before":"review-packet-valid","after":"human-decision-recorded"},"retry":{"safe":true},"deterministic":true}
