{"name":"plan-concepts","phase":"understand","version":1,"lead_agent":"integrator","consumes":["claim-set"],"produces":["concept-proposals"],"depends_on":["extract-claims"],"permissions":{"read":["workflow/runs/**/claims/**","knowledge-bases/**"],"write":["workflow/runs/**/proposals/**"]},"sensors":["proposal-schema-valid"],"gates":{"before":null,"after":"proposal-schema-valid"},"retry":{"safe":true},"deterministic":false}
